{
  "schema_version": "1.0.0",
  "session_id": "session-1",
  "kind": "hardware_import",
  "status": "created",
  "created_at": "2026-07-21T00:00:00Z",
  "started_at": { "value": null, "status": "absent" },
  "completed_at": { "value": null, "status": "absent" },
  "adapter": { "id": "generic.parquet", "version": "1.0.0" },
  "references": {
    "circuit": { "value": null, "status": "unknown" },
    "detector_error_model": { "value": null, "status": "unknown" },
    "topology": { "value": null, "status": "unknown" },
    "calibration": { "value": null, "status": "unavailable" }
  },
  "counts": {
    "detectors": { "value": 2, "status": "measured" },
    "observables": { "value": 1, "status": "measured" },
    "measurements": { "value": null, "status": "unknown" },
    "logical_patches": { "value": null, "status": "unknown" }
  },
  "source_clock": {
    "identity": { "value": null, "status": "unavailable" },
    "description": "Recorded source does not declare a hardware clock."
  },
  "timebase": {
    "domain": "round",
    "unit": { "value": "round", "status": "measured" },
    "tick_period": { "value": null, "status": "unavailable" },
    "description": "Integer round indices from the source."
  },
  "provenance_id": "provenance-1",
  "segments": []
}
